{
  "$schema": "./core-conformance.schema.json",
  "schemaVersion": 1,
  "source": "docs/aidl-core-subset.md",
  "layers": ["parse", "resolve", "validate", "ir", "generate", "ide"],
  "statusValues": ["not-applicable", "missing", "partial", "implemented"],
  "evidenceCatalog": {
    "spec-core": [{"path": "docs/aidl-core-subset.md", "type": "documentation"}],
    "parse-core": [{"path": "tools/aidl_parser.py", "type": "source"}, {"path": "tools/compiler_ast.py", "type": "source"}],
    "resolve-core": [{"path": "tools/compiler_project.py", "type": "source"}],
    "validate-core": [{"path": "tools/compiler_diagnostics.py", "type": "source"}, {"path": "tools/test_m5_fixture_corpus.py", "type": "test"}],
    "validate-types": [{"path": "tools/compiler_typecheck.py", "type": "source"}, {"path": "tools/test_core_typecheck.py", "type": "test"}],
    "ir-core": [{"path": "tools/compiler_ir.py", "type": "source"}, {"path": "spec/ir.schema.json", "type": "schema"}],
    "generate-core": [{"path": "tools/generate_m4.py", "type": "source"}, {"path": "tools/test_m4_petstore.py", "type": "test"}],
    "ide-core": [{"path": "plugins/intellij/AGENTS.md", "type": "documentation"}, {"path": ".github/workflows/python-validation.yml", "type": "workflow"}]
  },
  "declarationIds": ["decl.alias", "decl.api", "decl.app", "decl.consumer", "decl.entity", "decl.enum", "decl.error", "decl.event", "decl.import", "decl.module", "decl.mutation", "decl.opaque", "decl.query", "decl.service", "decl.topic", "decl.transaction", "decl.value"],
  "ruleIds": ["rule.api.exposure-version-compatibility", "rule.consumer.at-least-once", "rule.consumer.idempotency", "rule.entity.cross-service-ref-rejected", "rule.entity.owner-local-access", "rule.entity.single-owner", "rule.module.cyclic-dependency", "rule.module.duplicate-declaration", "rule.module.unresolved-name", "rule.mutation.required-clauses", "rule.mutation.single-root-effect", "rule.names.stable-fqn", "rule.query.side-effect-free", "rule.transaction.cross-resource-rejected", "rule.transaction.cross-service-rejected", "rule.transaction.outbox-atomic", "rule.transaction.resource-owner", "rule.types.int-to-decimal-only"],
  "features": [
    {"id":"decl.alias","category":"declaration","layerStatus":{"parse":"implemented","resolve":"implemented","validate":"implemented","ir":"implemented","generate":"partial","ide":"partial"},"layerEvidence":{"parse":["parse-core"],"resolve":["resolve-core"],"validate":["validate-core","validate-types"],"ir":["ir-core"],"generate":["generate-core"],"ide":["ide-core"]}},
    {"id":"decl.api","category":"declaration","layerStatus":{"parse":"implemented","resolve":"implemented","validate":"implemented","ir":"implemented","generate":"partial","ide":"partial"},"layerEvidence":{"parse":["parse-core"],"resolve":["resolve-core"],"validate":["validate-core","validate-types"],"ir":["ir-core"],"generate":["generate-core"],"ide":["ide-core"]}},
    {"id":"decl.app","category":"declaration","layerStatus":{"parse":"implemented","resolve":"implemented","validate":"partial","ir":"partial","generate":"not-applicable","ide":"partial"},"layerEvidence":{"parse":["parse-core"],"resolve":["resolve-core"],"validate":["validate-core"],"ir":["ir-core"],"generate":["spec-core"],"ide":["ide-core"]}},
    {"id":"decl.consumer","category":"declaration","layerStatus":{"parse":"implemented","resolve":"implemented","validate":"implemented","ir":"implemented","generate":"partial","ide":"partial"},"layerEvidence":{"parse":["parse-core"],"resolve":["resolve-core"],"validate":["validate-core"],"ir":["ir-core"],"generate":["generate-core"],"ide":["ide-core"]}},
    {"id":"decl.entity","category":"declaration","layerStatus":{"parse":"implemented","resolve":"implemented","validate":"implemented","ir":"implemented","generate":"implemented","ide":"partial"},"layerEvidence":{"parse":["parse-core"],"resolve":["resolve-core"],"validate":["validate-core","validate-types"],"ir":["ir-core"],"generate":["generate-core"],"ide":["ide-core"]}},
    {"id":"decl.enum","category":"declaration","layerStatus":{"parse":"implemented","resolve":"implemented","validate":"implemented","ir":"implemented","generate":"partial","ide":"partial"},"layerEvidence":{"parse":["parse-core"],"resolve":["resolve-core"],"validate":["validate-core"],"ir":["ir-core"],"generate":["generate-core"],"ide":["ide-core"]}},
    {"id":"decl.error","category":"declaration","layerStatus":{"parse":"implemented","resolve":"implemented","validate":"implemented","ir":"implemented","generate":"partial","ide":"partial"},"layerEvidence":{"parse":["parse-core"],"resolve":["resolve-core"],"validate":["validate-core","validate-types"],"ir":["ir-core"],"generate":["generate-core"],"ide":["ide-core"]}},
    {"id":"decl.event","category":"declaration","layerStatus":{"parse":"implemented","resolve":"implemented","validate":"implemented","ir":"implemented","generate":"partial","ide":"partial"},"layerEvidence":{"parse":["parse-core"],"resolve":["resolve-core"],"validate":["validate-core","validate-types"],"ir":["ir-core"],"generate":["generate-core"],"ide":["ide-core"]}},
    {"id":"decl.import","category":"declaration","layerStatus":{"parse":"implemented","resolve":"implemented","validate":"not-applicable","ir":"not-applicable","generate":"not-applicable","ide":"partial"},"layerEvidence":{"parse":["parse-core"],"resolve":["resolve-core"],"validate":["spec-core"],"ir":["spec-core"],"generate":["spec-core"],"ide":["ide-core"]}},
    {"id":"decl.module","category":"declaration","layerStatus":{"parse":"implemented","resolve":"implemented","validate":"implemented","ir":"not-applicable","generate":"not-applicable","ide":"partial"},"layerEvidence":{"parse":["parse-core"],"resolve":["resolve-core"],"validate":["validate-core"],"ir":["spec-core"],"generate":["spec-core"],"ide":["ide-core"]}},
    {"id":"decl.mutation","category":"declaration","layerStatus":{"parse":"implemented","resolve":"implemented","validate":"implemented","ir":"implemented","generate":"partial","ide":"partial"},"layerEvidence":{"parse":["parse-core"],"resolve":["resolve-core"],"validate":["validate-core","validate-types"],"ir":["ir-core"],"generate":["generate-core"],"ide":["ide-core"]}},
    {"id":"decl.opaque","category":"declaration","layerStatus":{"parse":"implemented","resolve":"implemented","validate":"implemented","ir":"implemented","generate":"partial","ide":"partial"},"layerEvidence":{"parse":["parse-core"],"resolve":["resolve-core"],"validate":["validate-core","validate-types"],"ir":["ir-core"],"generate":["generate-core"],"ide":["ide-core"]}},
    {"id":"decl.query","category":"declaration","layerStatus":{"parse":"implemented","resolve":"implemented","validate":"implemented","ir":"implemented","generate":"partial","ide":"partial"},"layerEvidence":{"parse":["parse-core"],"resolve":["resolve-core"],"validate":["validate-core","validate-types"],"ir":["ir-core"],"generate":["generate-core"],"ide":["ide-core"]}},
    {"id":"decl.service","category":"declaration","layerStatus":{"parse":"implemented","resolve":"implemented","validate":"implemented","ir":"implemented","generate":"partial","ide":"partial"},"layerEvidence":{"parse":["parse-core"],"resolve":["resolve-core"],"validate":["validate-core"],"ir":["ir-core"],"generate":["generate-core"],"ide":["ide-core"]}},
    {"id":"decl.topic","category":"declaration","layerStatus":{"parse":"implemented","resolve":"implemented","validate":"implemented","ir":"implemented","generate":"partial","ide":"partial"},"layerEvidence":{"parse":["parse-core"],"resolve":["resolve-core"],"validate":["validate-core"],"ir":["ir-core"],"generate":["generate-core"],"ide":["ide-core"]}},
    {"id":"decl.transaction","category":"declaration","layerStatus":{"parse":"implemented","resolve":"implemented","validate":"implemented","ir":"implemented","generate":"implemented","ide":"partial"},"layerEvidence":{"parse":["parse-core"],"resolve":["resolve-core"],"validate":["validate-core"],"ir":["ir-core"],"generate":["generate-core"],"ide":["ide-core"]}},
    {"id":"decl.value","category":"declaration","layerStatus":{"parse":"implemented","resolve":"implemented","validate":"implemented","ir":"implemented","generate":"partial","ide":"partial"},"layerEvidence":{"parse":["parse-core"],"resolve":["resolve-core"],"validate":["validate-core","validate-types"],"ir":["ir-core"],"generate":["generate-core"],"ide":["ide-core"]}},
    {"id":"rule.api.exposure-version-compatibility","category":"rule","layerStatus":{"parse":"not-applicable","resolve":"not-applicable","validate":"implemented","ir":"implemented","generate":"not-applicable","ide":"partial"},"layerEvidence":{"parse":["spec-core"],"resolve":["spec-core"],"validate":["validate-core"],"ir":["ir-core"],"generate":["spec-core"],"ide":["ide-core"]}},
    {"id":"rule.consumer.at-least-once","category":"rule","layerStatus":{"parse":"not-applicable","resolve":"not-applicable","validate":"implemented","ir":"not-applicable","generate":"not-applicable","ide":"partial"},"layerEvidence":{"parse":["spec-core"],"resolve":["spec-core"],"validate":["validate-core"],"ir":["spec-core"],"generate":["spec-core"],"ide":["ide-core"]}},
    {"id":"rule.consumer.idempotency","category":"rule","layerStatus":{"parse":"not-applicable","resolve":"not-applicable","validate":"implemented","ir":"implemented","generate":"partial","ide":"partial"},"layerEvidence":{"parse":["spec-core"],"resolve":["spec-core"],"validate":["validate-core"],"ir":["ir-core"],"generate":["generate-core"],"ide":["ide-core"]}},
    {"id":"rule.entity.cross-service-ref-rejected","category":"rule","layerStatus":{"parse":"not-applicable","resolve":"not-applicable","validate":"implemented","ir":"implemented","generate":"not-applicable","ide":"partial"},"layerEvidence":{"parse":["spec-core"],"resolve":["spec-core"],"validate":["validate-core"],"ir":["ir-core"],"generate":["spec-core"],"ide":["ide-core"]}},